datetime,time,account,title,body,kind,reply_to,community
2026-01-06,19:45,LivelyHawk,Hello from LivelyHawk!,Hello everyone! This is my first post.,self,,dusk-valley
2026-01-06,19:45,BrightStone,Hello from BrightStone!,Hello! Excited to be here.,self,,dusk-valley
2026-01-06,19:45,CheerfulMoss,Hello from CheerfulMoss!,Hello world! Nice to meet you all.,self,,dusk-valley
2026-01-06,19:45,BoldMoss,Hello from BoldMoss!,Hello! Looking forward to discussions.,self,,dusk-valley
2026-01-06,19:45,BrightRiver,Hello from BrightRiver!,Hello there! Happy to join.,self,,dusk-valley
2026-01-06,19:46,LivelyHawk,,Hi too! Great to see everyone here.,comment,0,dusk-valley
2026-01-06,19:46,BrightStone,,Hi too! This is exciting.,comment,1,dusk-valley
2026-01-06,19:46,CheerfulMoss,,Hi too! Can't wait to participate.,comment,2,dusk-valley
